Bundle	ArticleId	Paper	Venue	Author
Bundle 1	36	Learning Communicating Automata from MSCs.	IEEE Trans. Software Eng.	Benedikt Bollig, Martin Leucker, Carsten Kern, Joost-Pieter Katoen	
Bundle 1	2594	HOTTest: A model-based test design technique for enhanced testing of domain-specific applications.	ACM Trans. Softw. Eng. Methodol.	Carol Smidts, Avik Sinha	
Bundle 1	2877	A lightweight approach for program analysis and debugging.	ICSE	M. G. Rakesh	
Bundle 1	2912	DESERT: a decentralized monitoring tool generator.	ASE	Paola Inverardi, Leonardo Mostarda	
Bundle 1	5489	PENELOPE: weaving threads to expose atomicity violations.	SIGSOFT FSE	Francesco Sorrentino 0002, Azadeh Farzan, P. Madhusudan	
Bundle 2	68	Performance of Storage Management in an Implementation of SNOBOL4.	IEEE Trans. Software Eng.	Ralph E. Griswold, David R. Hanson, G. David Ripley	
Bundle 2	2664	Model checking the Java metalocking algorithm.	ACM Trans. Softw. Eng. Methodol.	Scott A. Smolka, Samik Basu	
Bundle 2	2992	Software design sketching with calico.	ASE	André van der Hoek, Nicolas Mangano, Mitch Dempsey, Alex Baker, Emily Oh Navarro	
Bundle 2	3853	Towards Safe Distributed Application Development.	ICSE	Rachid Guerraoui, Christian Heide Damm, Patrick Th. Eugster	
Bundle 2	5380	Checking Relational Specifications With Binary Decision Diagrams.	SIGSOFT FSE	Daniel Jackson, Craig Damon, Somesh Jha	
Bundle 3	597	GUI Interaction Testing: Incorporating Event Context.	IEEE Trans. Software Eng.	Myra B. Cohen, Atif M. Memon, Xun Yuan	
Bundle 3	2608	Test conditions for fault classes in Boolean specifications.	ACM Trans. Softw. Eng. Methodol.	Jonathan P. Bowen, Kalpesh Kapoor	
Bundle 3	3029	Test suite reduction and prioritization with call trees.	ASE	Mary Lou Soffa, Gregory M. Kapfhammer, Joshua Geiger, Adam M. Smith	
Bundle 3	3551	Experimental program analysis: a new paradigm for program analysis.	ICSE	Joseph R. Ruthruff	
Bundle 3	5276	Automated identification of parameter mismatches in web applications.	SIGSOFT FSE	Alessandro Orso, William G. J. Halfond	
Bundle 4	57	Interface Grammars for Modular Software Model Checking.	IEEE Trans. Software Eng.	Tevfik Bultan, Graham Hughes	
Bundle 4	2781	Amoeba: A methodology for modeling and evolving cross-organizational business processes.	ACM Trans. Softw. Eng. Methodol.	Nirmit Desai, Amit K. Chopra, Munindar P. Singh	
Bundle 4	2931	Japanese Workshop on Leveraging Web2.0 Technologies in Software Development Environments (WebSDE).	ASE	Makoto Matsushita, Katsuhisa Maruyama, Shinichiro Yamamoto	
Bundle 4	3669	Architectures and Technologies for Enterprise Application Integration.	ICSE	Ian Gorton, Anna Liu	
Bundle 4	5212	Local analysis of atomicity sphere for B2B collaboration.	SIGSOFT FSE	Chang Xu, Chunyang Ye, W. K. Chan, S. C. Cheung	
Bundle 5	26	Comments on Program Slicing.	IEEE Trans. Software Eng.	Hareton K. N. Leung, Hassan K. Reghbati	
Bundle 5	2740	Software reuse for scientific computing through program generation.	ACM Trans. Softw. Eng. Methodol.	Martin Erwig, Zhe Fu	
Bundle 5	3097	Automatic Generation of Content Management Systems from EER-Based Specifications.	ASE	Sebastiano Vigna	
Bundle 5	3798	Enhancing Software Testing by Judicious Use of Code Coverage Information.	ICSE	Roland Weber, Stefan Berner, Rudolf K. Keller	
Bundle 5	5213	Automatically locating framework extension examples.	SIGSOFT FSE	Harold Ossher, Barthélémy Dagenais	
Bundle 6	63	On the Optimal Total Processing Time Using Checkpoints.	IEEE Trans. Software Eng.	Zohel Khalil, Boyan Dimitrov, Nikolay Kolev, Peter Petrov	
Bundle 6	2731	Equivalence analysis and its application in improving the efficiency of program slicing.	ACM Trans. Softw. Eng. Methodol.	Mary Jean Harrold, Donglin Liang	
Bundle 6	3116	Synthesizing client load models for performance engineering via web crawling.	ASE	John C. Grundy, John G. Hosking, Yuhong Cai	
Bundle 6	3801	Spontaneous software: a Web-based, object computing paradigm.	ICSE	Glêdson Elias da Silveira	
Bundle 6	5302	Containment units: a hierarchically composable architecture for adaptive systems.	SIGSOFT FSE	Leon J. Osterweil, Barbara Staudt Lerner, Alexander E. Wise, Jamieson M. Cobleigh	
Bundle 7	1356	Experiences Using Lightweight Formal Methods for Requirements Modeling.	IEEE Trans. Software Eng.	David Hamilton, Steve M. Easterbrook, Robyn R. Lutz, John Kelly, Richard Covington, Yoko Ampo	
Bundle 7	2635	Metamodel-based model conformance and multiview consistency checking.	ACM Trans. Softw. Eng. Methodol.	Jonathan S. Ostroff, Richard F. Paige, Phillip J. Brooke	
Bundle 7	2999	Automating Software Traceability in Very Small Companies: A Case Study and Lessons Learne.	ASE	Paul Grünbacher, Christian Neumuller	
Bundle 7	4220	Metrics for model driven requirements development.	ICSE	Brian Berenbach, Gail Borotto	
Bundle 7	5294	Composable semantics for model-based notations.	SIGSOFT FSE	Jianwei Niu, Joanne M. Atlee, Nancy A. Day	
Bundle 8	62	Validating a Demonstration Tool for Graphics-Assisted Debugging of Ada Concurrent Programs.	IEEE Trans. Software Eng.	Michael B. Feldman, Melinda L. Moran	
Bundle 8	2643	Unifying aspect- and object-oriented design.	ACM Trans. Softw. Eng. Methodol.	Kevin J. Sullivan, Hridesh Rajan	
Bundle 8	2937	Eliminating products to test in a software product line.	ASE	Don S. Batory, Sarfraz Khurshid, Chang Hwan Peter Kim	
Bundle 8	3767	Requirements, domain and specifications: a viewpoint-based approach to requirements engineering.	ICSE	Andrés Silva	
Bundle 8	5316	Effective blame for information-flow violations.	SIGSOFT FSE	Somesh Jha, Dave King 0002, Trent Jaeger, Sanjit A. Seshia	
Bundle 9	762	Carving and Replaying Differential Unit Test Cases from System Test Cases.	IEEE Trans. Software Eng.	Sebastian G. Elbaum, Matthew B. Dwyer, Matthew Jorde, Hui Nee Chin	
Bundle 9	2678	Empirical evaluation of a nesting testability transformation for evolutionary testing.	ACM Trans. Softw. Eng. Methodol.	David Binkley, Mark Harman, Phil McMinn	
Bundle 9	3038	Unit testing concurrent software.	ASE	William Pugh, Nathaniel Ayewah	
Bundle 9	3749	Practical change impact analysis based on static program slicing for industrial software systems.	ICSE	Mithun Acharya, Brian Robinson	
Bundle 9	5363	Efficient incremental algorithms for dynamic detection of likely invariants.	SIGSOFT FSE	Michael D. Ernst, Jeff H. Perkins	
Bundle 10	111	An Interval Logic for Real-Time System Specification.	IEEE Trans. Software Eng.	Paolo Nesi, Riccardo Mattolini	
Bundle 10	2602	Reasoning about static and dynamic properties in alloy: A purely relational approach.	ACM Trans. Softw. Eng. Methodol.	Nazareno Aguirre, T. S. E. Maibaum, Gabriel A. Baum, Marcelo F. Frias, Carlos López Pombo	
Bundle 10	2927	Automated Software Engineering Using Concurrent Class Machines.	ASE	Scott A. Smolka, Yanhong A. Liu, Jingyu Yan, Scott D. Stoller, Radu Grosu	
Bundle 10	3650	HighSpec: a tool for building and checking OZTA models.	ICSE	Shengchao Qin, Jin Song Dong, Ping Hao, Xian Zhang	
Bundle 10	5233	COM revisited: tool-assisted modelling of an architectural framework.	SIGSOFT FSE	Daniel Jackson, Kevin J. Sullivan	
Objetive function	70.205